{
  "$schema": "https://json-schema.org/draft/2020-12/schema",
  "$id": "https://cloudfall.internal/schemas/v1/operation-decision.schema.json",
  "title": "Cloudfall operation decision",
  "description": "What an agent proposed, what check mode showed, who let it, and what came of it.",
  "type": "object",
  "properties": {
    "apiVersion": {
      "$ref": "common.schema.json#/$defs/apiVersion"
    },
    "kind": {
      "const": "OperationDecision"
    },
    "metadata": {
      "$ref": "common.schema.json#/$defs/metadata"
    },
    "spec": {
      "type": "object",
      "properties": {
        "proposedAt": {
          "type": "string",
          "format": "date-time"
        },
        "operation": {
          "type": "object",
          "properties": {
            "id": {
              "$ref": "common.schema.json#/$defs/resourceId"
            },
            "playbook": {
              "type": "string",
              "minLength": 1,
              "maxLength": 512
            },
            "risk": {
              "enum": [
                "read",
                "mutating",
                "destructive"
              ]
            },
            "verifyPlaybook": {
              "type": "string",
              "minLength": 1,
              "maxLength": 512
            }
          },
          "required": [
            "id",
            "playbook",
            "risk"
          ],
          "additionalProperties": false
        },
        "targets": {
          "type": "object",
          "properties": {
            "scope": {
              "enum": [
                "fleet",
                "group",
                "host"
              ]
            },
            "pattern": {
              "type": "string",
              "minLength": 1,
              "maxLength": 200
            }
          },
          "required": [
            "scope"
          ],
          "additionalProperties": false
        },
        "inputs": {
          "type": "object",
          "additionalProperties": {
            "type": [
              "string",
              "integer",
              "boolean"
            ]
          }
        },
        "gate": {
          "type": "object",
          "properties": {
            "requirement": {
              "enum": [
                "runs-freely",
                "check-then-approve",
                "human-required"
              ]
            },
            "reason": {
              "type": "string",
              "minLength": 1,
              "maxLength": 300
            }
          },
          "required": [
            "requirement",
            "reason"
          ],
          "additionalProperties": false
        },
        "basis": {
          "type": "object",
          "description": "The fleet evidence the proposal was made against.",
          "properties": {
            "observations": {
              "type": "string",
              "minLength": 1,
              "maxLength": 512
            },
            "observedAt": {
              "type": "object",
              "additionalProperties": {
                "type": "string",
                "format": "date-time"
              }
            }
          },
          "required": [
            "observations",
            "observedAt"
          ],
          "additionalProperties": false
        },
        "check": {
          "type": "object",
          "description": "What check mode reported before any change was made.",
          "properties": {
            "exitCode": {
              "type": "integer",
              "minimum": 0,
              "maximum": 255
            },
            "changed": {
              "type": "array",
              "items": {
                "type": "string",
                "minLength": 1,
                "maxLength": 253
              }
            },
            "unchanged": {
              "type": "array",
              "items": {
                "type": "string",
                "minLength": 1,
                "maxLength": 253
              }
            },
            "diff": {
              "type": "object",
              "properties": {
                "path": {
                  "type": "string",
                  "minLength": 1,
                  "maxLength": 512
                },
                "sha256": {
                  "$ref": "common.schema.json#/$defs/sha256"
                },
                "bytes": {
                  "type": "integer",
                  "minimum": 0
                }
              },
              "required": [
                "path",
                "sha256",
                "bytes"
              ],
              "additionalProperties": false
            }
          },
          "required": [
            "exitCode",
            "changed",
            "unchanged",
            "diff"
          ],
          "additionalProperties": false
        },
        "status": {
          "enum": [
            "proposed",
            "approved",
            "rejected",
            "executed",
            "verified",
            "failed",
            "ran",
            "superseded"
          ]
        },
        "ranExitCode": {
          "description": "The exit code of a read operation's run, which happens when it is proposed. Set when the status is ran.",
          "type": "integer",
          "minimum": 0,
          "maximum": 255
        },
        "supersededBy": {
          "description": "The decision that proposed the same operation, targets and inputs again. Set when the status is superseded.",
          "$ref": "common.schema.json#/$defs/resourceId"
        },
        "approval": {
          "type": "object",
          "properties": {
            "approver": {
              "type": "string",
              "minLength": 1,
              "maxLength": 128
            },
            "approvedAt": {
              "type": "string",
              "format": "date-time"
            },
            "via": {
              "description": "How the approval arrived: terminal when a person typed the decision id at a terminal. A record written before this field reads as unknown.",
              "type": "string",
              "enum": [
                "terminal",
                "unknown"
              ]
            }
          },
          "required": [
            "approver",
            "approvedAt"
          ],
          "additionalProperties": false
        },
        "execution": {
          "type": "object",
          "properties": {
            "ranAt": {
              "type": "string",
              "format": "date-time"
            },
            "exitCode": {
              "type": "integer",
              "minimum": 0,
              "maximum": 255
            },
            "changed": {
              "type": "array",
              "items": {
                "type": "string",
                "minLength": 1,
                "maxLength": 253
              }
            },
            "unchanged": {
              "type": "array",
              "items": {
                "type": "string",
                "minLength": 1,
                "maxLength": 253
              }
            },
            "log": {
              "type": "object",
              "properties": {
                "path": {
                  "type": "string",
                  "minLength": 1,
                  "maxLength": 512
                },
                "sha256": {
                  "$ref": "common.schema.json#/$defs/sha256"
                },
                "bytes": {
                  "type": "integer",
                  "minimum": 0
                }
              },
              "required": [
                "path",
                "sha256",
                "bytes"
              ],
              "additionalProperties": false
            }
          },
          "required": [
            "ranAt",
            "exitCode",
            "changed",
            "unchanged",
            "log"
          ],
          "additionalProperties": false,
          "description": "What the approved run did."
        },
        "verify": {
          "type": "object",
          "properties": {
            "ranAt": {
              "type": "string",
              "format": "date-time"
            },
            "exitCode": {
              "type": "integer",
              "minimum": 0,
              "maximum": 255
            },
            "changed": {
              "type": "array",
              "items": {
                "type": "string",
                "minLength": 1,
                "maxLength": 253
              }
            },
            "unchanged": {
              "type": "array",
              "items": {
                "type": "string",
                "minLength": 1,
                "maxLength": 253
              }
            },
            "log": {
              "type": "object",
              "properties": {
                "path": {
                  "type": "string",
                  "minLength": 1,
                  "maxLength": 512
                },
                "sha256": {
                  "$ref": "common.schema.json#/$defs/sha256"
                },
                "bytes": {
                  "type": "integer",
                  "minimum": 0
                }
              },
              "required": [
                "path",
                "sha256",
                "bytes"
              ],
              "additionalProperties": false
            }
          },
          "required": [
            "ranAt",
            "exitCode",
            "changed",
            "unchanged",
            "log"
          ],
          "additionalProperties": false,
          "description": "What the operation's verify playbook reported afterwards."
        },
        "verdict": {
          "type": "string",
          "description": "Why the decision ended in its status.",
          "minLength": 1,
          "maxLength": 300
        }
      },
      "required": [
        "proposedAt",
        "operation",
        "targets",
        "inputs",
        "gate",
        "basis",
        "check",
        "status"
      ],
      "allOf": [
        {
          "if": {
            "properties": {
              "status": {
                "const": "ran"
              }
            }
          },
          "then": {
            "required": [
              "ranExitCode"
            ]
          }
        },
        {
          "if": {
            "properties": {
              "status": {
                "const": "superseded"
              }
            }
          },
          "then": {
            "required": [
              "supersededBy"
            ]
          }
        }
      ],
      "additionalProperties": false
    }
  },
  "required": [
    "apiVersion",
    "kind",
    "metadata",
    "spec"
  ],
  "additionalProperties": false
}
