{
  "apiVersion": "cloudfall/v1",
  "kind": "OperationDecision",
  "metadata": {
    "id": "disk-report-20261008204348"
  },
  "spec": {
    "basis": {
      "observations": "tmp/observed",
      "observedAt": {}
    },
    "check": {
      "changed": [],
      "diff": {
        "bytes": 2346,
        "path": "approved/disk-report-20261008204348.diff",
        "sha256": "f746242b8130f2ac64cd1868b25bcaea309d5bb31223ddc85d43660ea1bd7d50"
      },
      "exitCode": 0,
      "unchanged": [
        "hz1"
      ]
    },
    "gate": {
      "reason": "a read operation changes nothing, so nothing gates it",
      "requirement": "runs-freely"
    },
    "inputs": {},
    "operation": {
      "id": "disk-report",
      "playbook": "playbooks/disk-report.yml",
      "risk": "read"
    },
    "proposedAt": "2026-10-08T20:43:48Z",
    "status": "proposed",
    "targets": {
      "pattern": "hz1",
      "scope": "host"
    }
  }
}
