{
  "apiVersion": "cloudfall/v1",
  "kind": "OperationDecision",
  "metadata": {
    "id": "service-logs-20261008170740"
  },
  "spec": {
    "basis": {
      "observations": "tmp/observed",
      "observedAt": {}
    },
    "check": {
      "changed": [],
      "diff": {
        "bytes": 1078,
        "path": "tmp/eval/NVIDIA-Nemotron-3-Nano-30B-A3B/0/decisions/service-logs-20261008170740.diff",
        "sha256": "1f4c6700f06426c2c2047d36a4d77147e54fc071654a8685160867b2c7977ec9"
      },
      "exitCode": 0,
      "unchanged": [
        "hz1"
      ]
    },
    "gate": {
      "reason": "a read operation changes nothing, so nothing gates it",
      "requirement": "runs-freely"
    },
    "inputs": {
      "unit": "postgresql@main.service"
    },
    "operation": {
      "id": "service-logs",
      "playbook": "playbooks/service-logs.yml",
      "risk": "read"
    },
    "proposedAt": "2026-10-08T17:07:40Z",
    "status": "proposed",
    "targets": {
      "pattern": "hz1",
      "scope": "host"
    }
  }
}
