{
  "apiVersion": "cloudfall/v1",
  "kind": "OperationDecision",
  "metadata": {
    "id": "journal-vacuum-20261008171016"
  },
  "spec": {
    "basis": {
      "observations": "tmp/observed",
      "observedAt": {}
    },
    "check": {
      "changed": [],
      "diff": {
        "bytes": 925,
        "path": "tmp/eval/Nemotron-3_5-Lightning/0/decisions/journal-vacuum-20261008171016.diff",
        "sha256": "d0b17a713ef5fca9ca03b359eb6693f8ea526a6d8a184099fd7bcc6b6b9945dd"
      },
      "exitCode": 0,
      "unchanged": []
    },
    "gate": {
      "reason": "a mutating operation runs in check mode first and waits for an approval of the recorded diff",
      "requirement": "check-then-approve"
    },
    "inputs": {},
    "operation": {
      "id": "journal-vacuum",
      "playbook": "playbooks/journal-vacuum.yml",
      "risk": "mutating",
      "verifyPlaybook": "playbooks/disk-report.yml"
    },
    "proposedAt": "2026-10-08T17:10:16Z",
    "status": "proposed",
    "targets": {
      "pattern": "hz1",
      "scope": "host"
    }
  }
}
