{
  "apiVersion": "cloudfall/v1",
  "kind": "OperationDecision",
  "metadata": {
    "id": "postgresql-restart-20261008170624"
  },
  "spec": {
    "basis": {
      "observations": "tmp/observed",
      "observedAt": {}
    },
    "check": {
      "changed": [
        "hz1"
      ],
      "diff": {
        "bytes": 924,
        "path": "tmp/eval/Nemotron-3-Ultra-550b-a55b/0/decisions/postgresql-restart-20261008170624.diff",
        "sha256": "daea76fdfb4c117c0e052066522c4927640515f0be3cd770693250fd1a08b18c"
      },
      "exitCode": 0,
      "unchanged": []
    },
    "gate": {
      "reason": "a mutating operation runs in check mode first and waits for an approval of the recorded diff",
      "requirement": "check-then-approve"
    },
    "inputs": {},
    "operation": {
      "id": "postgresql-restart",
      "playbook": "playbooks/postgresql-restart.yml",
      "risk": "mutating",
      "verifyPlaybook": "playbooks/postgresql.yml"
    },
    "proposedAt": "2026-10-08T17:06:24Z",
    "status": "proposed",
    "targets": {
      "pattern": "hz1",
      "scope": "host"
    }
  }
}
